{
  "cells": [
    {
      "count": 1,
      "key": "custom/short/cold",
      "length": "short",
      "maximumTrimLevel": 0,
      "mode": "custom",
      "modelID": "pro_custom",
      "statistics": {
        "audioSeconds": {
          "count": 1,
          "iqr": 0.0,
          "max": 1.84,
          "median": 1.84,
          "min": 1.84
        },
        "blockIOOperations": {
          "count": 1,
          "iqr": 0.0,
          "max": 0.0,
          "median": 0.0,
          "min": 0.0
        },
        "chunksReceived": {
          "count": 1,
          "iqr": 0.0,
          "max": 4.0,
          "median": 4.0,
          "min": 4.0
        },
        "contextSwitches": {
          "count": 1,
          "iqr": 0.0,
          "max": 19797.0,
          "median": 19797.0,
          "min": 19797.0
        },
        "continuityFailures": {
          "count": 1,
          "iqr": 0.0,
          "max": 0.0,
          "median": 0.0,
          "min": 0.0
        },
        "cpuSystemSeconds": {
          "count": 1,
          "iqr": 0.0,
          "max": 0.6880219999999999,
          "median": 0.6880219999999999,
          "min": 0.6880219999999999
        },
        "cpuUserSeconds": {
          "count": 1,
          "iqr": 0.0,
          "max": 0.7463449999999998,
          "median": 0.7463449999999998,
          "min": 0.7463449999999998
        },
        "decodeWallSeconds": {
          "count": 1,
          "iqr": 0.0,
          "max": 1.036,
          "median": 1.036,
          "min": 1.036
        },
        "delayedHeartbeatCount": {
          "count": 1,
          "iqr": 0.0,
          "max": 0.0,
          "median": 0.0,
          "min": 0.0
        },
        "finalizationMS": {
          "count": 1,
          "iqr": 0.0,
          "max": 1.0,
          "median": 1.0,
          "min": 1.0
        },
        "firstChunkToPlaybackScheduledMS": {
          "count": 1,
          "iqr": 0.0,
          "max": 858.0,
          "median": 858.0,
          "min": 858.0
        },
        "generatedTokens": {
          "count": 1,
          "iqr": 0.0,
          "max": 23.0,
          "median": 23.0,
          "min": 23.0
        },
        "heartbeatCoverage": {
          "count": 1,
          "iqr": 0.0,
          "max": 0.933333,
          "median": 0.933333,
          "min": 0.933333
        },
        "maximumTrimLevel": {
          "count": 1,
          "iqr": 0.0,
          "max": 0.0,
          "median": 0.0,
          "min": 0.0
        },
        "memoryTrimCount": {
          "count": 1,
          "iqr": 0.0,
          "max": 0.0,
          "median": 0.0,
          "min": 0.0
        },
        "minimumHeadroomMB": {
          "count": 1,
          "iqr": 0.0,
          "max": 3662.9034271240234,
          "median": 3662.9034271240234,
          "min": 3662.9034271240234
        },
        "minimumQueueDurationMS": {
          "count": 1,
          "iqr": 0.0,
          "max": 560.0,
          "median": 560.0,
          "min": 560.0
        },
        "modelLoadMS": {
          "count": 1,
          "iqr": 0.0,
          "max": 336.0,
          "median": 336.0,
          "min": 336.0
        },
        "pageFaults": {
          "count": 1,
          "iqr": 0.0,
          "max": 135049.0,
          "median": 135049.0,
          "min": 135049.0
        },
        "peakCompressedMB": {
          "count": 1,
          "iqr": 0.0,
          "max": 0.0,
          "median": 0.0,
          "min": 0.0
        },
        "peakGPUAllocatedMB": {
          "count": 1,
          "iqr": 0.0,
          "max": 2242.640625,
          "median": 2242.640625,
          "min": 2242.640625
        },
        "peakPhysicalFootprintMB": {
          "count": 1,
          "iqr": 0.0,
          "max": 2481.0965728759766,
          "median": 2481.0965728759766,
          "min": 2481.0965728759766
        },
        "peakResidentMB": {
          "count": 1,
          "iqr": 0.0,
          "max": 2212.796875,
          "median": 2212.796875,
          "min": 2212.796875
        },
        "playbackScheduledMS": {
          "count": 1,
          "iqr": 0.0,
          "max": 1554.0,
          "median": 1554.0,
          "min": 1554.0
        },
        "rtf": {
          "count": 1,
          "iqr": 0.0,
          "max": 1.776061776061776,
          "median": 1.776061776061776,
          "min": 1.776061776061776
        },
        "samplerBoundarySampleCount": {
          "count": 1,
          "iqr": 0.0,
          "max": 9.0,
          "median": 9.0,
          "min": 9.0
        },
        "samplerCaptureFailureCount": {
          "count": 1,
          "iqr": 0.0,
          "max": 0.0,
          "median": 0.0,
          "min": 0.0
        },
        "samplerEffectiveMedianIntervalMS": {
          "count": 1,
          "iqr": 0.0,
          "max": 521.3353539999999,
          "median": 521.3353539999999,
          "min": 521.3353539999999
        },
        "samplerMaximumDriftMS": {
          "count": 1,
          "iqr": 0.0,
          "max": 47.633165999999996,
          "median": 47.633165999999996,
          "min": 47.633165999999996
        },
        "samplerMaximumLatenessMS": {
          "count": 1,
          "iqr": 0.0,
          "max": 47.633165999999996,
          "median": 47.633165999999996,
          "min": 47.633165999999996
        },
        "samplerTargetIntervalMS": {
          "count": 1,
          "iqr": 0.0,
          "max": 500.0,
          "median": 500.0,
          "min": 500.0
        },
        "startBufferDepth": {
          "count": 1,
          "iqr": 0.0,
          "max": 4.0,
          "median": 4.0,
          "min": 4.0
        },
        "submitToCompletedMS": {
          "count": 1,
          "iqr": 0.0,
          "max": 1554.0,
          "median": 1554.0,
          "min": 1554.0
        },
        "submitToFirstChunkMS": {
          "count": 1,
          "iqr": 0.0,
          "max": 696.0,
          "median": 696.0,
          "min": 696.0
        },
        "tokensPerSecond": {
          "count": 1,
          "iqr": 0.0,
          "max": 22.170959256213656,
          "median": 22.170959256213656,
          "min": 22.170959256213656
        },
        "uiMaximumDelayedHeartbeatMS": {
          "count": 1,
          "iqr": 0.0,
          "max": 7.0,
          "median": 7.0,
          "min": 7.0
        },
        "underruns": {
          "count": 1,
          "iqr": 0.0,
          "max": 0.0,
          "median": 0.0,
          "min": 0.0
        }
      },
      "status": "passed",
      "variant": "speed",
      "warmState": "cold",
      "warningCount": 0,
      "worstQCVerdict": "pass",
      "worstThermalState": "nominal"
    },
    {
      "count": 1,
      "key": "custom/short/warm",
      "length": "short",
      "maximumTrimLevel": 0,
      "mode": "custom",
      "modelID": "pro_custom",
      "statistics": {
        "audioSeconds": {
          "count": 1,
          "iqr": 0.0,
          "max": 2.24,
          "median": 2.24,
          "min": 2.24
        },
        "blockIOOperations": {
          "count": 1,
          "iqr": 0.0,
          "max": 0.0,
          "median": 0.0,
          "min": 0.0
        },
        "chunksReceived": {
          "count": 1,
          "iqr": 0.0,
          "max": 4.0,
          "median": 4.0,
          "min": 4.0
        },
        "contextSwitches": {
          "count": 1,
          "iqr": 0.0,
          "max": 19586.0,
          "median": 19586.0,
          "min": 19586.0
        },
        "continuityFailures": {
          "count": 1,
          "iqr": 0.0,
          "max": 0.0,
          "median": 0.0,
          "min": 0.0
        },
        "cpuSystemSeconds": {
          "count": 1,
          "iqr": 0.0,
          "max": 0.29713199999999984,
          "median": 0.29713199999999984,
          "min": 0.29713199999999984
        },
        "cpuUserSeconds": {
          "count": 1,
          "iqr": 0.0,
          "max": 0.4727939999999999,
          "median": 0.4727939999999999,
          "min": 0.4727939999999999
        },
        "decodeWallSeconds": {
          "count": 1,
          "iqr": 0.0,
          "max": 1.266,
          "median": 1.266,
          "min": 1.266
        },
        "delayedHeartbeatCount": {
          "count": 1,
          "iqr": 0.0,
          "max": 0.0,
          "median": 0.0,
          "min": 0.0
        },
        "finalizationMS": {
          "count": 1,
          "iqr": 0.0,
          "max": 0.0,
          "median": 0.0,
          "min": 0.0
        },
        "firstChunkToPlaybackScheduledMS": {
          "count": 1,
          "iqr": 0.0,
          "max": 1029.0,
          "median": 1029.0,
          "min": 1029.0
        },
        "generatedTokens": {
          "count": 1,
          "iqr": 0.0,
          "max": 28.0,
          "median": 28.0,
          "min": 28.0
        },
        "heartbeatCoverage": {
          "count": 1,
          "iqr": 0.0,
          "max": 1.0,
          "median": 1.0,
          "min": 1.0
        },
        "maximumTrimLevel": {
          "count": 1,
          "iqr": 0.0,
          "max": 0.0,
          "median": 0.0,
          "min": 0.0
        },
        "memoryTrimCount": {
          "count": 1,
          "iqr": 0.0,
          "max": 0.0,
          "median": 0.0,
          "min": 0.0
        },
        "minimumHeadroomMB": {
          "count": 1,
          "iqr": 0.0,
          "max": 3577.1534271240234,
          "median": 3577.1534271240234,
          "min": 3577.1534271240234
        },
        "minimumQueueDurationMS": {
          "count": 1,
          "iqr": 0.0,
          "max": 560.0,
          "median": 560.0,
          "min": 560.0
        },
        "modelLoadMS": {
          "count": 1,
          "iqr": 0.0,
          "max": 0.0,
          "median": 0.0,
          "min": 0.0
        },
        "pageFaults": {
          "count": 1,
          "iqr": 0.0,
          "max": 717.0,
          "median": 717.0,
          "min": 717.0
        },
        "peakCompressedMB": {